"pl-scientificAssistant-title","Научный Ассистент"
"pk-researchAssistance-1-title","Помощь в исследованиях I"
"pk-researchAssistance-2-title","Помощь в исследованиях II"
"pk-researchAssistance-3-title","Помощь в исследованиях III"
"pk-researchAssistance-4-title","Помощь в исследованиях IV"
"pk-researchAssistance-description","Находка нового экземпляра бабочки сильнее восстанавливает мораль."
"evt-harbor-recruit-scientificAssistant-action","$name ассистент"
"evt-harbor-recruit-scientificAssistant","[Науки много не бывает|Уверен{|а}, ассистент мне очень поможет|], так что я пригласил{|а} $name в нашу команду."
"mod-scientifictAss-desc","Добавляет персонажа для вербовки в гавани. Дополнительное восстановление морали при сборе бабочек (складывается с навыком Дарвина). Навык позволяет использовать интересные стратегии планирования маршрута с учётом расположения бабочек."
